<?xml version="1.0" encoding="UTF-8"?>
<storageProviders 
		application="UnitTests" 
		xmlns="http://www.rubicon-it.com/Data/DomainObjects/Persistence/1.0" 
		xmlns:xsi="http://www.w3.org/2001/XMLSchema-instance" 
		xsi:schemaLocation="http://www.rubicon-it.com/Data/DomainObjects/Persistence/1.0 ..\storageProviders.xsd">
		
	<storageProvider id="TestDomain">
	  <!-- Unspecified type generates a StorageProviderConfigurationException when file is loaded. -->
		<type></type>
		<configuration type="Rubicon.Data.DomainObjects.Persistence.Rdbms.RdbmsProviderDefinition, Rubicon.Data.DomainObjects">
			<connectionString xmlns="http://www.rubicon-it.com/Data/DomainObjects/Persistence/Rdbms">Integrated Security=SSPI;Initial Catalog=TestDomain;Data Source=localhost</connectionString>		
		</configuration>
	</storageProvider>
	<storageProvider id="UnitTestStorageProviderStub">
		<type>Rubicon.Data.DomainObjects.UnitTests.UnitTestStorageProviderStub, Rubicon.Data.DomainObjects.UnitTests</type>
		<configuration type="Rubicon.Data.DomainObjects.UnitTests.UnitTestStorageProviderStubDefinition, Rubicon.Data.DomainObjects.UnitTests" />
	</storageProvider>

</storageProviders>
