<?xml version="1.0" encoding="UTF-8"?>
<storageProviders 
		application="UnitTests" 
		xmlns="http://www.rubicon-it.com/Data/DomainObjects/Persistence/1.0" 
		xmlns:xsi="http://www.w3.org/2001/XMLSchema-instance" 
		xsi:schemaLocation="http://www.rubicon-it.com/Data/DomainObjects/Persistence/1.0 ..\DomainObjects\storageProviders.xsd">
		
	<storageProvider id="FirstStorageProvider">
		<type>Rubicon.Data.DomainObjects.Persistence.Rdbms.SqlProvider, Rubicon.Data.DomainObjects</type>
		<configuration type="Rubicon.Data.DomainObjects.Persistence.Rdbms.RdbmsProviderDefinition, Rubicon.Data.DomainObjects">
			<connectionString xmlns="http://www.rubicon-it.com/Data/DomainObjects/Persistence/Rdbms">Integrated Security=SSPI;Initial Catalog=CodeGeneratorUnitTests1;Data Source=localhost</connectionString>		
		</configuration>
	</storageProvider>
	<storageProvider id="SecondStorageProvider">
    <type>Rubicon.Data.DomainObjects.Persistence.Rdbms.SqlProvider, Rubicon.Data.DomainObjects</type>
    <configuration type="Rubicon.Data.DomainObjects.Persistence.Rdbms.RdbmsProviderDefinition, Rubicon.Data.DomainObjects">
      <connectionString xmlns="http://www.rubicon-it.com/Data/DomainObjects/Persistence/Rdbms">Integrated Security=SSPI;Initial Catalog=CodeGeneratorUnitTests2;Data Source=localhost</connectionString>
    </configuration>
  </storageProvider>
  <storageProvider id="NonRdbmsStorageProvider">
    <type>Rubicon.Data.DomainObjects.CodeGenerator.UnitTests.NonRdbmsStorageProvider, Rubicon.Data.DomainObjects.CodeGenerator.UnitTests</type>
    <configuration type="Rubicon.Data.DomainObjects.CodeGenerator.UnitTests.NonRdbmsStorageProviderDefinition, Rubicon.Data.DomainObjects.CodeGenerator.UnitTests" />
  </storageProvider>

</storageProviders>
